{
  "schema_version": "1.0",
  "batch_id": "BATCH-c1bb0237fbc5ef53",
  "source_id": "AUTOMACAO_DM_R00_05",
  "source_revision": "R00-05",
  "created_at": "2026-08-28T18:00:00+00:00",
  "records": [
    {"ingestion_id":"ING-05ab16535d1ee88666b7","entity_type":"source","external_id":"AUTOMACAO-DM-R00-05","payload":{"document_title":"AUTOMAÇÃO — DIAGRAMA DE MALHA","revision":"R00-05","table_title":"SÍMBOLOS DE INSTRUMENTOS","matrix":{"function_families":4,"physical_locations":4,"cells":16},"dimension_note":{"explicit_text":"DIÂMETRO = 12mm","explicitly_attached_to":"instrumento_discreto_campo","generalization_to_all_cells":"not_explicit_on_reference_sheet"}},"provenance":{"document":"AUTOMAÇÃO DM R00-05.pdf","page":1,"section":"Símbolos de instrumentos","source_id":"AUTOMACAO_DM_R00_05"},"evidence_class":"E2_PROJECT_DOCUMENT","review_status":"REVIEW_REQUIRED","auto_promoted":false},
    {"ingestion_id":"ING-bbe0748eb030b2f094d3","entity_type":"symbol","external_id":"DM-INSTRUMENTO_DISCRETO-CAMPO","payload":{"standard":"AUTOMAÇÃO DM R00-05","symbol_family":"instrumento_discreto","base_geometry":"circle","physical_location":"field","location_marking":"none","matrix_cell":"instrumento_discreto__field","geometry_policy":"exact_reference_geometry_no_approximation_or_deformation","explicit_dimension_mm":12,"dimension_evidence":"explicit_on_sheet"},"provenance":{"document":"AUTOMAÇÃO DM R00-05.pdf","page":1,"section":"Símbolos de instrumentos","row":"instrumento_discreto","column":"field","source_id":"AUTOMACAO_DM_R00_05"},"evidence_class":"E2_PROJECT_DOCUMENT","review_status":"REVIEW_REQUIRED","auto_promoted":false},
    {"ingestion_id":"ING-7b0eed13cf3ae69d8776","entity_type":"symbol","external_id":"DM-INSTRUMENTO_DISCRETO-PAINEL_PRINCIPAL","payload":{"standard":"AUTOMAÇÃO DM R00-05","symbol_family":"instrumento_discreto","base_geometry":"circle","physical_location":"main_control_panel","location_marking":"one_solid_horizontal_bar","matrix_cell":"instrumento_discreto__main_control_panel","geometry_policy":"exact_reference_geometry_no_approximation_or_deformation","explicit_dimension_mm":null,"dimension_evidence":"not_explicit_for_this_cell_on_reference_sheet"},"provenance":{"document":"AUTOMAÇÃO DM R00-05.pdf","page":1,"section":"Símbolos de instrumentos","row":"instrumento_discreto","column":"main_control_panel","source_id":"AUTOMACAO_DM_R00_05"},"evidence_class":"E2_PROJECT_DOCUMENT","review_status":"REVIEW_REQUIRED","auto_promoted":false},
    {"ingestion_id":"ING-4b190b770225e17dc3e3","entity_type":"symbol","external_id":"DM-INSTRUMENTO_DISCRETO-ATRAS_PAINEL_PRINCIPAL","payload":{"standard":"AUTOMAÇÃO DM R00-05","symbol_family":"instrumento_discreto","base_geometry":"circle","physical_location":"behind_main_control_panel","location_marking":"one_dashed_horizontal_bar","matrix_cell":"instrumento_discreto__behind_main_control_panel","geometry_policy":"exact_reference_geometry_no_approximation_or_deformation","explicit_dimension_mm":null,"dimension_evidence":"not_explicit_for_this_cell_on_reference_sheet"},"provenance":{"document":"AUTOMAÇÃO DM R00-05.pdf","page":1,"section":"Símbolos de instrumentos","row":"instrumento_discreto","column":"behind_main_control_panel","source_id":"AUTOMACAO_DM_R00_05"},"evidence_class":"E2_PROJECT_DOCUMENT","review_status":"REVIEW_REQUIRED","auto_promoted":false},
    {"ingestion_id":"ING-d4263e9c9950467751e6","entity_type":"symbol","external_id":"DM-INSTRUMENTO_DISCRETO-PAINEL_LOCAL_EQUIPAMENTO","payload":{"standard":"AUTOMAÇÃO DM R00-05","symbol_family":"instrumento_discreto","base_geometry":"circle","physical_location":"local_equipment_panel","location_marking":"two_solid_horizontal_bars","matrix_cell":"instrumento_discreto__local_equipment_panel","geometry_policy":"exact_reference_geometry_no_approximation_or_deformation","explicit_dimension_mm":null,"dimension_evidence":"not_explicit_for_this_cell_on_reference_sheet"},"provenance":{"document":"AUTOMAÇÃO DM R00-05.pdf","page":1,"section":"Símbolos de instrumentos","row":"instrumento_discreto","column":"local_equipment_panel","source_id":"AUTOMACAO_DM_R00_05"},"evidence_class":"E2_PROJECT_DOCUMENT","review_status":"REVIEW_REQUIRED","auto_promoted":false},
    {"ingestion_id":"ING-592fd733b1dbf1abea40","entity_type":"symbol","external_id":"DM-DISPLAY_COMPARTILHADO-CAMPO","payload":{"standard":"AUTOMAÇÃO DM R00-05","symbol_family":"display_compartilhado","base_geometry":"circle_inside_square","physical_location":"field","location_marking":"none","matrix_cell":"display_compartilhado__field","geometry_policy":"exact_reference_geometry_no_approximation_or_deformation","explicit_dimension_mm":null,"dimension_evidence":"not_explicit_for_this_cell_on_reference_sheet"},"provenance":{"document":"AUTOMAÇÃO DM R00-05.pdf","page":1,"section":"Símbolos de instrumentos","row":"display_compartilhado","column":"field","source_id":"AUTOMACAO_DM_R00_05"},"evidence_class":"E2_PROJECT_DOCUMENT","review_status":"REVIEW_REQUIRED","auto_promoted":false},
    {"ingestion_id":"ING-b94400d74ee0f5fdd840","entity_type":"symbol","external_id":"DM-DISPLAY_COMPARTILHADO-PAINEL_PRINCIPAL","payload":{"standard":"AUTOMAÇÃO DM R00-05","symbol_family":"display_compartilhado","base_geometry":"circle_inside_square","physical_location":"main_control_panel","location_marking":"one_solid_horizontal_bar","matrix_cell":"display_compartilhado__main_control_panel","geometry_policy":"exact_reference_geometry_no_approximation_or_deformation","explicit_dimension_mm":null,"dimension_evidence":"not_explicit_for_this_cell_on_reference_sheet"},"provenance":{"document":"AUTOMAÇÃO DM R00-05.pdf","page":1,"section":"Símbolos de instrumentos","row":"display_compartilhado","column":"main_control_panel","source_id":"AUTOMACAO_DM_R00_05"},"evidence_class":"E2_PROJECT_DOCUMENT","review_status":"REVIEW_REQUIRED","auto_promoted":false},
    {"ingestion_id":"ING-9edafa1147e26182e5af","entity_type":"symbol","external_id":"DM-DISPLAY_COMPARTILHADO-ATRAS_PAINEL_PRINCIPAL","payload":{"standard":"AUTOMAÇÃO DM R00-05","symbol_family":"display_compartilhado","base_geometry":"circle_inside_square","physical_location":"behind_main_control_panel","location_marking":"one_dashed_horizontal_bar","matrix_cell":"display_compartilhado__behind_main_control_panel","geometry_policy":"exact_reference_geometry_no_approximation_or_deformation","explicit_dimension_mm":null,"dimension_evidence":"not_explicit_for_this_cell_on_reference_sheet"},"provenance":{"document":"AUTOMAÇÃO DM R00-05.pdf","page":1,"section":"Símbolos de instrumentos","row":"display_compartilhado","column":"behind_main_control_panel","source_id":"AUTOMACAO_DM_R00_05"},"evidence_class":"E2_PROJECT_DOCUMENT","review_status":"REVIEW_REQUIRED","auto_promoted":false},
    {"ingestion_id":"ING-a6db8d76872dd18425d3","entity_type":"symbol","external_id":"DM-DISPLAY_COMPARTILHADO-PAINEL_LOCAL_EQUIPAMENTO","payload":{"standard":"AUTOMAÇÃO DM R00-05","symbol_family":"display_compartilhado","base_geometry":"circle_inside_square","physical_location":"local_equipment_panel","location_marking":"two_solid_horizontal_bars","matrix_cell":"display_compartilhado__local_equipment_panel","geometry_policy":"exact_reference_geometry_no_approximation_or_deformation","explicit_dimension_mm":null,"dimension_evidence":"not_explicit_for_this_cell_on_reference_sheet"},"provenance":{"document":"AUTOMAÇÃO DM R00-05.pdf","page":1,"section":"Símbolos de instrumentos","row":"display_compartilhado","column":"local_equipment_panel","source_id":"AUTOMACAO_DM_R00_05"},"evidence_class":"E2_PROJECT_DOCUMENT","review_status":"REVIEW_REQUIRED","auto_promoted":false},
    {"ingestion_id":"ING-11a7f257460004354149","entity_type":"symbol","external_id":"DM-FUNCAO_COMPUTADOR-CAMPO","payload":{"standard":"AUTOMAÇÃO DM R00-05","symbol_family":"funcao_executada_no_computador","base_geometry":"hexagon","physical_location":"field","location_marking":"none","matrix_cell":"funcao_executada_no_computador__field","geometry_policy":"exact_reference_geometry_no_approximation_or_deformation","explicit_dimension_mm":null,"dimension_evidence":"not_explicit_for_this_cell_on_reference_sheet"},"provenance":{"document":"AUTOMAÇÃO DM R00-05.pdf","page":1,"section":"Símbolos de instrumentos","row":"funcao_executada_no_computador","column":"field","source_id":"AUTOMACAO_DM_R00_05"},"evidence_class":"E2_PROJECT_DOCUMENT","review_status":"REVIEW_REQUIRED","auto_promoted":false},
    {"ingestion_id":"ING-b73e55277b3b2686a3fd","entity_type":"symbol","external_id":"DM-FUNCAO_COMPUTADOR-PAINEL_PRINCIPAL","payload":{"standard":"AUTOMAÇÃO DM R00-05","symbol_family":"funcao_executada_no_computador","base_geometry":"hexagon","physical_location":"main_control_panel","location_marking":"one_solid_horizontal_bar","matrix_cell":"funcao_executada_no_computador__main_control_panel","geometry_policy":"exact_reference_geometry_no_approximation_or_deformation","explicit_dimension_mm":null,"dimension_evidence":"not_explicit_for_this_cell_on_reference_sheet"},"provenance":{"document":"AUTOMAÇÃO DM R00-05.pdf","page":1,"section":"Símbolos de instrumentos","row":"funcao_executada_no_computador","column":"main_control_panel","source_id":"AUTOMACAO_DM_R00_05"},"evidence_class":"E2_PROJECT_DOCUMENT","review_status":"REVIEW_REQUIRED","auto_promoted":false},